{
  "$schema": "https://json-schema.org/draft/2020-12/schema",
  "$id": "https://raw.githubusercontent.com/StellarCanary/ProtocolCanary-Fixtures/main/schemas/upstream-matrix.json",
  "title": "Protocol Canary upstream version matrix (matrixVersion 1)",
  "description": "Which upstream component releases belong to each Stellar protocol version. A component's `range` is a set of space-separated semver comparators that a release must satisfy to be the software for that protocol; the major version of every upstream component tracks the protocol version.",
  "$comment": "Validated with tools/validate/jsonschema_lite.py, which implements only the keywords used here. `protocols` requires the sections for the protocols this repository documents (28 and 29); adding a protocol means adding its section to upstream-matrix.json and to `required` below in the same change. The protocol keys are strings because JSON object keys are.",
  "type": "object",
  "required": [
    "matrixVersion",
    "protocols"
  ],
  "additionalProperties": false,
  "properties": {
    "$schema": {
      "type": "string",
      "minLength": 1
    },
    "matrixVersion": {
      "type": "integer",
      "const": 1
    },
    "source": {
      "type": "string",
      "pattern": "^https://[^\\s/?#@]+/[^\\s]+$",
      "description": "The page the versions were read from."
    },
    "checkedOn": {
      "type": "string",
      "pattern": "^[0-9]{4}-[0-9]{2}-[0-9]{2}$",
      "description": "The date `source` was read, as YYYY-MM-DD."
    },
    "protocols": {
      "type": "object",
      "required": [
        "28",
        "29"
      ],
      "minProperties": 1,
      "additionalProperties": false,
      "patternProperties": {
        "^(?:0|[1-9][0-9]*)$": {
          "$ref": "#/$defs/protocolSection"
        }
      }
    }
  },
  "$defs": {
    "semverRange": {
      "type": "string",
      "pattern": "^(?:>=|<=|>|<|=)?(?:0|[1-9][0-9]*)\\.(?:0|[1-9][0-9]*)\\.(?:0|[1-9][0-9]*)(?: (?:>=|<=|>|<|=)?(?:0|[1-9][0-9]*)\\.(?:0|[1-9][0-9]*)\\.(?:0|[1-9][0-9]*))*$",
      "description": "One or more space-separated comparators (`>=`, `<=`, `>`, `<`, `=` or none) each followed by MAJOR.MINOR.PATCH with no leading zeros and no `v` prefix, for example `>=28.0.0 <29.0.0`."
    },
    "component": {
      "type": "object",
      "required": [
        "repository",
        "range"
      ],
      "additionalProperties": false,
      "properties": {
        "repository": {
          "type": "string",
          "pattern": "^[A-Za-z0-9_.-]+/[A-Za-z0-9_.-]+$",
          "description": "The upstream GitHub repository as owner/name."
        },
        "range": {
          "$ref": "#/$defs/semverRange"
        }
      }
    },
    "protocolSection": {
      "type": "object",
      "required": [
        "stellar-core",
        "soroban-rpc",
        "rs-soroban-env"
      ],
      "additionalProperties": false,
      "properties": {
        "stellar-core": {
          "$ref": "#/$defs/component"
        },
        "soroban-rpc": {
          "$ref": "#/$defs/component"
        },
        "rs-soroban-env": {
          "$ref": "#/$defs/component"
        }
      }
    }
  }
}
